{
  "version": 2,
  "last_verified": "2026-10-09",
  "source": "Assembled on 2026-10-09 from official and government sources; every entry carries its own source_url and last_verified date. No number is published here that could not be traced to a source: entries whose source was secondary or conflicting carry needs_verification=true and say why in verification_note. A person must re-check this file before it ships to anyone in distress (AGENTS.md safety rule 6).",
  "disclaimer": "These lines are free, confidential and staffed by trained people. Manovia is not a crisis service and cannot send help to you.",
  "regions": [
    "IN",
    "US",
    "GB",
    "AU",
    "CA",
    "DEFAULT"
  ],
  "resources": [
    {
      "id": "in-emergency-112",
      "region": "IN",
      "kind": "emergency",
      "name": "112 — India emergency number (ERSS)",
      "number": "112",
      "type": "call",
      "instructions": "One number for police, fire, ambulance and women's safety. The 112 India app can send a panic alert.",
      "hours": "24/7",
      "languages": [
        "en",
        "hi",
        "and other Indian languages"
      ],
      "audience": "everyone",
      "description": "India's single national emergency number. Call it if you or someone with you is in immediate physical danger.",
      "url": null,
      "source_url": "https://cdac.in/index.aspx?id=print_page&print=blog_ni_erss",
      "last_verified": "2026-10-09",
      "needs_verification": false,
      "verification_note": "Number confirmed by the C-DAC Emergency Response Support System page and Ministry of Home Affairs reporting; the canonical 112.gov.in site was not reachable from the build sandbox.",
      "priority": 2
    },
    {
      "id": "in-tele-manas",
      "region": "IN",
      "kind": "crisis_line",
      "name": "Tele-MANAS (national mental health helpline)",
      "number": "14416",
      "type": "call",
      "instructions": "Toll free. Alternate toll-free number: 1-800-891-4416. You choose the language when you call.",
      "hours": "24/7",
      "languages": [
        "en",
        "hi",
        "and 20 regional languages"
      ],
      "audience": "everyone",
      "description": "Government of India's free, round-the-clock tele-mental-health service. Trained counsellors listen, and can connect you to a mental health professional, a video consultation or local services.",
      "url": "https://telemanas.mohfw.gov.in",
      "source_url": "https://www.pib.gov.in/PressReleasePage.aspx?PRID=1866498&reg=48&lang=2",
      "last_verified": "2026-10-09",
      "needs_verification": false,
      "verification_note": null,
      "priority": 4
    },
    {
      "id": "in-vandrevala-foundation",
      "region": "IN",
      "kind": "crisis_line",
      "name": "Vandrevala Foundation",
      "number": "+919999666555",
      "type": "call",
      "instructions": "Call or send a WhatsApp message to the same number.",
      "hours": "24/7",
      "languages": [
        "en",
        "hi",
        "mr",
        "gu",
        "bn",
        "kn",
        "ta",
        "te",
        "ml",
        "or",
        "Tulu"
      ],
      "audience": "everyone",
      "description": "A free crisis-intervention and counselling helpline run by a national mental-health non-profit, available by phone and WhatsApp.",
      "url": "https://www.vandrevalafoundation.com",
      "source_url": "https://www.vandrevalafoundation.com/free-counseling",
      "last_verified": "2026-10-09",
      "needs_verification": false,
      "verification_note": "The foundation's own current page lists +91 9999 666 555; older articles also list 1860-2662-345 and 1800-233-3330, which are not published on the site today.",
      "priority": 8
    },
    {
      "id": "in-icall",
      "region": "IN",
      "kind": "crisis_line",
      "name": "iCall (TISS psychosocial helpline)",
      "number": "9152987821",
      "type": "call",
      "instructions": "Free telephone and email counselling: icall@tiss.ac.in. Two-way anonymous — they do not ask for your name.",
      "hours": "Mon–Sat, 8:00 am – 9:00 pm IST",
      "languages": [
        "en",
        "hi",
        "mr",
        "gu",
        "as",
        "bn",
        "pa",
        "ml"
      ],
      "audience": "everyone",
      "description": "A psychosocial helpline run by the Tata Institute of Social Sciences, including support for abuse, violence, gender and sexuality concerns.",
      "url": "https://icallhelpline.org",
      "source_url": "https://icallhelpline.org/hopeless/",
      "last_verified": "2026-10-09",
      "needs_verification": true,
      "verification_note": "The number is consistent across iCall's own pages, but the published hours conflict: one page says Mon–Sat 8:00 am–9:00 pm, another says 10:00 am–8:00 pm. Confirm the hours with iCall before shipping.",
      "priority": 12
    },
    {
      "id": "in-kiran",
      "region": "IN",
      "kind": "crisis_line",
      "name": "KIRAN (mental health rehabilitation helpline)",
      "number": "18005990019",
      "type": "call",
      "instructions": "Toll free, launched by the Ministry of Social Justice and Empowerment (DEPwD).",
      "hours": "24/7",
      "languages": [
        "en",
        "hi",
        "ta",
        "gu",
        "ur",
        "as",
        "kn",
        "ml",
        "and 5 more"
      ],
      "audience": "everyone",
      "description": "A national toll-free first-line counselling and referral helpline for stress, anxiety, depression and suicidal thoughts, with a focus on persons with disabilities.",
      "url": null,
      "source_url": "https://theprint.in/health/govt-launches-kiran-a-24x7-helpline-for-people-to-seek-mental-health-counselling/497542/",
      "last_verified": "2026-10-09",
      "needs_verification": true,
      "verification_note": "Only secondary sources were reachable from the build sandbox (ThePrint, 2020, and a state National Health Mission helpline PDF). No current ministry page was found. Confirm with MoSJE/DEPwD that the line is still staffed before shipping.",
      "priority": 20
    },
    {
      "id": "in-aasra",
      "region": "IN",
      "kind": "crisis_line",
      "name": "AASRA",
      "number": "+919820466726",
      "type": "call",
      "instructions": null,
      "hours": "24/7 (reported)",
      "languages": [
        "en",
        "hi"
      ],
      "audience": "everyone",
      "description": "A Mumbai-based crisis-intervention centre for people who are lonely, distressed or suicidal.",
      "url": "https://www.aasra.info",
      "source_url": "https://nhm.hp.gov.in/storage/app/media/uploaded-files/Mental%20Health%20Support%20Numbers.pdf",
      "last_verified": "2026-10-09",
      "needs_verification": true,
      "verification_note": "Listed in a state National Health Mission helpline PDF and in the Find A Helpline directory, but aasra.info itself was not fetched from the build sandbox and third-party listings disagree about hours. Verify by calling before shipping.",
      "priority": 24
    },
    {
      "id": "us-emergency-911",
      "region": "US",
      "kind": "emergency",
      "name": "911 — emergency services",
      "number": "911",
      "type": "call",
      "instructions": "Text-to-911 is available in many (not all) US areas.",
      "hours": "24/7",
      "languages": [
        "en",
        "es",
        "interpretation available"
      ],
      "audience": "everyone",
      "description": "Police, fire and ambulance. Call it if you or someone with you is in immediate danger or needs urgent medical help.",
      "url": null,
      "source_url": "https://www.fcc.gov/general/9-1-1-and-e9-1-1-services",
      "last_verified": "2026-10-09",
      "needs_verification": false,
      "verification_note": null,
      "priority": 2
    },
    {
      "id": "us-988",
      "region": "US",
      "kind": "crisis_line",
      "name": "988 Suicide & Crisis Lifeline",
      "number": "988",
      "type": "call",
      "instructions": "Free and confidential. You can also call if you are worried about someone else.",
      "hours": "24/7",
      "languages": [
        "en",
        "es"
      ],
      "audience": "everyone",
      "description": "The US national lifeline for mental-health, suicide and substance-use crises, answered by trained crisis counsellors.",
      "url": "https://988lifeline.org",
      "source_url": "https://www.samhsa.gov/mental-health/988/faqs",
      "last_verified": "2026-10-09",
      "needs_verification": false,
      "verification_note": null,
      "priority": 4
    },
    {
      "id": "us-crisis-text-line",
      "region": "US",
      "kind": "text_line",
      "name": "Crisis Text Line",
      "number": "741741",
      "type": "text",
      "text_keyword": "HOME",
      "instructions": "Text HOME to 741741.",
      "hours": "24/7",
      "languages": [
        "en",
        "es"
      ],
      "audience": "everyone",
      "description": "Free, confidential text-message support from a trained volunteer crisis counsellor.",
      "url": "https://www.crisistextline.org",
      "source_url": "https://www.crisistextline.org/",
      "last_verified": "2026-10-09",
      "needs_verification": false,
      "verification_note": null,
      "priority": 8
    },
    {
      "id": "us-988-chat",
      "region": "US",
      "kind": "crisis_line",
      "name": "988 Lifeline — online chat",
      "number": null,
      "type": "chat",
      "instructions": "A short pre-chat survey connects you to a crisis counsellor.",
      "hours": "24/7",
      "languages": [
        "en",
        "es"
      ],
      "audience": "everyone",
      "description": "The same 988 Lifeline support by web chat, for when talking out loud is not possible.",
      "url": "https://988lifeline.org/chat",
      "source_url": "https://www.samhsa.gov/mental-health/988/faqs",
      "last_verified": "2026-10-09",
      "needs_verification": false,
      "verification_note": null,